ID;brand;model;color;price;description
301f1053-a98a-44a9-a9bd-e5497a03529c;Fender;Stratocaster;Sunburst;1500.00;Classic electric guitar with a versatile sound
0b6aaefd-401d-4e4d-99c9-d289dab8ca95;Gibson;Les Paul;Black;2000.00;Iconic rock guitar known for its rich tone
8518a4e2-9950-498b-93dc-dbddd482bedc;Ibanez;RG550;Blue;1200.00;High-performance guitar with a fast neck
f387f315-3dbe-4a1d-bc55-2ab866015475;PRS;Custom 24;Red;1800.00;Versatile guitar with a beautiful finish
ff88c032-0f1b-4774-b851-5136c49f5319;Taylor;814ce;Natural;2500.00;Acoustic-electric guitar with a warm tone